Unnamed: 0,question,answer,questions_german,answers_german
873,it goes on and on forever.,"and it's deep, too.",es geht weiter und weiter.,und es ist auch tief.
874,"and it's deep, too.",i think it's five miles deep.,und es ist auch tief.,"ich glaube, es ist 5 Meilen tief."
875,i think it's five miles deep.,are there fish at the bottom?,"ich glaube, es ist 5 Meilen tief.",Gibt es Fisch am Boden?
876,are there fish at the bottom?,there are fish at the top and the bottom.,Gibt es Fisch am Boden?,Es gibt Fische oben und unten.
877,there are fish at the top and the bottom.,are there more fish or more people?,Es gibt Fische oben und unten.,Gibt es mehr Fisch oder mehr Menschen?
878,are there more fish or more people?,i think there are more fish.,Gibt es mehr Fisch oder mehr Menschen?,"Ich denke, es gibt mehr Fisch."
879,i think there are more fish.,i hope so. i love to eat fish.,"Ich denke, es gibt mehr Fisch.","Ich hoffe, dass ich Fisch essen kann."
880,i'm upset with my mom.,why is that?,ich bin stört mit meiner Mutter.,Warum?
881,why is that?,i warned her about her new boyfriend. she didn't listen to me.,Warum?,"ich habe sie vor ihrem neuen Freund gewarnt, sie hörte mir"
882,i warned her about her new boyfriend. she didn't listen to me.,what happened?,"ich habe sie vor ihrem neuen Freund gewarnt, sie hörte mir",Was ist passiert?
883,what happened?,"i gave her $1,000 for her birthday. i told her to spend it on herself.",Was ist passiert?,"ich hat ihr 1.000 Dollar für ihren Geburtstag gegeben, ich habe ihr"
884,"i gave her $1,000 for her birthday. i told her to spend it on herself.",that was very nice of you.,"ich hat ihr 1.000 Dollar für ihren Geburtstag gegeben, ich habe ihr",Das war sehr schön von Ihnen.
885,that was very nice of you.,i found out that she gave it to her new boyfriend.,Das war sehr schön von Ihnen.,"ich habe herausgefunden, dass sie es ihrem neuen Freund gab."
886,i found out that she gave it to her new boyfriend.,why did she do that?,"ich habe herausgefunden, dass sie es ihrem neuen Freund gab.",Warum hat sie das getan?
887,why did she do that?,he said he would buy her a nice ring.,Warum hat sie das getan?,"er sagte, er würde sie einen schönen Ring kaufen."
888,he said he would buy her a nice ring.,what's wrong with that?,"er sagte, er würde sie einen schönen Ring kaufen.",Was ist damit falsch?
889,what's wrong with that?,he went to las vegas. he lost it all gambling.,Was ist damit falsch?,"er ging nach Las vegas, er hat es alles Glück"
890,he went to las vegas. he lost it all gambling.,i hope your mom broke up with him.,"er ging nach Las vegas, er hat es alles Glück","ich hoffe, dass deine Mutter mit ihm zerstört hat"
891,do animals talk to each other?,of course they talk to each other.,Sprechen Tiere miteinander?,Natürlich sprechen sie miteinander.
892,of course they talk to each other.,what do they talk about?,Natürlich sprechen sie miteinander.,Was sprechen sie?
893,what do they talk about?,they talk about other animals.,Was sprechen sie?,Sie sprechen von anderen Tieren.
894,they talk about other animals.,what else do they talk about?,Sie sprechen von anderen Tieren.,Worüber sprechen sie sonst?
895,what else do they talk about?,they talk about food and the weather.,Worüber sprechen sie sonst?,Sie sprechen über Essen und das Wetter.
896,they talk about food and the weather.,do they talk about us?,Sie sprechen über Essen und das Wetter.,reden sie von uns?
897,do they talk about us?,of course they talk about us.,reden sie von uns?,Natürlich sprechen sie von uns.
898,of course they talk about us.,what do they say about us?,Natürlich sprechen sie von uns.,Was sagen sie über uns?
899,what do they say about us?,they say that we are funny-looking.,Was sagen sie über uns?,"sie sagen, dass wir lustig aussehen."
900,they say that we are funny-looking.,ha! we're not funny-looking; animals are funny-looking.,"sie sagen, dass wir lustig aussehen.","ha! wir sind nicht lustig, Tiere sind lustig."
901,ha! we're not funny-looking; animals are funny-looking.,we're funny-looking because we wear clothes.,"ha! wir sind nicht lustig, Tiere sind lustig.","Wir sind lustig, weil wir Kleidung tragen."
902,i have to clean the house.,"yes, it's very dirty.",i have to clean the house.,"ja, es ist sehr schmutzig."
903,"yes, it's very dirty.",you can help me.,"ja, es ist sehr schmutzig.",Sie können mir helfen.
904,you can help me.,why me?,Sie können mir helfen.,Warum ich?
905,why me?,because you helped make it dirty.,Warum ich?,weil Sie es schmutzig gemacht haben.
906,because you helped make it dirty.,what do you want me to do?,weil Sie es schmutzig gemacht haben.,Was willst du tun?
907,what do you want me to do?,i want you to clean the bathroom.,Was willst du tun?,The room was very clean and the staff were very helpful.
908,i want you to clean the bathroom.,"oh, that's easy.",The room was very clean and the staff were very helpful.,"oh, das ist einfach."
909,"oh, that's easy.","clean the sink, the tub, the counter, and the toilet.","oh, das ist einfach.",Die zentrale Lage des Hotels ist sehr gut.
910,"clean the sink, the tub, the counter, and the toilet.",that's a lot of work.,Die zentrale Lage des Hotels ist sehr gut.,Das ist eine Menge Arbeit.
911,that's a lot of work.,tell me when you finish.,Das ist eine Menge Arbeit.,"sage mir, wann du fertig bist."
912,tell me when you finish.,i don't think so. you'll just give me more work.,"sage mir, wann du fertig bist.","ich glaube nicht, du lasse mich einfach mehr Arbeit geben."
913,you're watching too much tv.,what do you mean?,"ich habe es nicht geschafft, ich habe es nicht gesehen",Was meinen Sie?
914,what do you mean?,i mean you're wasting your life.,Was meinen Sie?,i mean you're wasting your life.
915,i mean you're wasting your life.,i'm having fun.,i mean you're wasting your life.,ich habe Spaß.
916,i'm having fun.,you're sitting there with your mouth open.,ich habe Spaß.,Sie sitzen dort mit Ihrem Mund offen.
917,you're sitting there with your mouth open.,who cares?,Sie sitzen dort mit Ihrem Mund offen.,Wer sorgt?
918,who cares?,i care. do something.,Wer sorgt?,ich muß etwas tun.
919,i care. do something.,okay. i did something.,ich muß etwas tun.,"Sehr freundliches Personal, freundliches Personal, hilfsbereite"
920,okay. i did something.,what did you do?,"Sehr freundliches Personal, freundliches Personal, hilfsbereite",Was haben Sie getan?
921,what did you do?,i turned up the volume.,Was haben Sie getan?,ich habe das Volumen aufgetaucht.
922,i turned up the volume.,"that's not what i meant by ""do something.""",ich habe das Volumen aufgetaucht.,"Das ist nicht das, was ich mit ""tue etwas"" gemeint habe"
923,"that's not what i meant by ""do something.""",will you do something? leave me alone.,"Das ist nicht das, was ich mit ""tue etwas"" gemeint habe",Sollten Sie etwas tun? lassen Sie mich allein.
924,did you write a letter to grandma?,"yes, i did.",schrieben Sie einen Brief an die Großmutter?,"ja, ich habe es getan."
925,"yes, i did.",did you tell her about school?,"ja, ich habe es getan.",hat ihr die Schule erzählt?
926,did you tell her about school?,i told her that school is fun.,hat ihr die Schule erzählt?,"ich sagte ihr, dass die Schule Spaß macht."
927,i told her that school is fun.,did you put the letter in an envelope?,"ich sagte ihr, dass die Schule Spaß macht.",Haben Sie den Brief in einen Umschlag gesetzt?
928,did you put the letter in an envelope?,"yes, and i sealed the envelope.",Haben Sie den Brief in einen Umschlag gesetzt?,"ja, und ich habe den Umschlag versiegelt."
929,"yes, and i sealed the envelope.",did you put a stamp on the envelope?,"ja, und ich habe den Umschlag versiegelt.",Haben Sie einen Stempel auf den Umschlag gesetzt?
930,did you put a stamp on the envelope?,i couldn't find any stamps.,Haben Sie einen Stempel auf den Umschlag gesetzt?,ich habe keine Stempel gefunden.
931,i couldn't find any stamps.,they're in the kitchen drawer.,ich habe keine Stempel gefunden.,Sie befinden sich in der Schublade der Küche.
932,they're in the kitchen drawer.,okay. i just put a stamp on the envelope.,Sie befinden sich in der Schublade der Küche.,"ich habe es geschafft, ich habe es geschafft,"
933,okay. i just put a stamp on the envelope.,"give me the envelope, and i'll mail it for you.","ich habe es geschafft, ich habe es geschafft,","teilen Sie mir den Briefumschlag, und ich werde ihn für Sie schicken."
934,"give me the envelope, and i'll mail it for you.",when is grandma going to learn about e-mail?,"teilen Sie mir den Briefumschlag, und ich werde ihn für Sie schicken.",wann wird die Großmutter über E-Mail erfahren?
935,why are you yawning?,i'm sleepy.,Warum streifen Sie?,ich bin schlafend.
936,i'm sleepy.,why don't you go to bed?,ich bin schlafend.,Warum gehen Sie nicht zum Bett?
937,why don't you go to bed?,i want to watch this tv show.,Warum gehen Sie nicht zum Bett?,ich möchte diese Fernsehshow anschauen.
938,i want to watch this tv show.,maybe you should record it.,ich möchte diese Fernsehshow anschauen.,Vielleicht sollten Sie es aufzeichnen.
939,maybe you should record it.,the tape recorder is broken.,Vielleicht sollten Sie es aufzeichnen.,der Bandschreiber ist gebrochen.
940,the tape recorder is broken.,then you should watch the rerun.,der Bandschreiber ist gebrochen.,dann sollten Sie die Wiedergabe ansehen.
941,then you should watch the rerun.,why? i'm watching the original.,dann sollten Sie die Wiedergabe ansehen.,Warum?
942,why? i'm watching the original.,but you'll be asleep in about one minute.,Warum?,- aber Sie werden in etwa einer Minute schlafen.
943,but you'll be asleep in about one minute.,i'm just yawning because the commercials are on.,- aber Sie werden in etwa einer Minute schlafen.,"ich bin nur störend, weil die Werbespots auf dem Markt"
944,i'm just yawning because the commercials are on.,okay. i'll tell you how the show ends.,"ich bin nur störend, weil die Werbespots auf dem Markt","ich sage euch, wie die Show endet."
945,okay. i'll tell you how the show ends.,zzz.,"ich sage euch, wie die Show endet.",zzz.
946,it's sunday.,so?,es ist Sonntag.,so?
947,so?,you know what that means.,so?,"Sie wissen, was das bedeutet."
948,you know what that means.,i forgot.,"Sie wissen, was das bedeutet.",ich habe vergessen.
949,i forgot.,sunday means we go to church.,ich habe vergessen.,"Sonntag bedeutet, dass wir zur Kirche gehen."
950,sunday means we go to church.,"oh, yeah.","Sonntag bedeutet, dass wir zur Kirche gehen.","oh, ja."
951,"oh, yeah.",put on a coat and tie.,"oh, ja.",setzen Sie auf ein Fell und ziehen Sie sich.
952,put on a coat and tie.,why?,setzen Sie auf ein Fell und ziehen Sie sich.,Warum?
953,why?,to show respect to god and others.,Warum?,zu respektieren Gott und andere.
954,to show respect to god and others.,i'm glad sunday is only once a week.,zu respektieren Gott und andere.,"ich bin froh, dass Sonntag nur einmal pro Woche ist."
955,i'm glad sunday is only once a week.,i hope god didn't hear that.,"ich bin froh, dass Sonntag nur einmal pro Woche ist.","ich hoffe, Gott hat das nicht hören."
956,i hope god didn't hear that.,he'll forgive me.,"ich hoffe, Gott hat das nicht hören.",er wird mir verzeihen.
957,did you feed the cat?,i'll do that in a minute.,hatt ihr die Katze ernährt?,ich werde das in einer Minute tun.
958,i'll do that in a minute.,the cat is meowing. he's hungry.,ich werde das in einer Minute tun.,"er hat es geschafft, die Katze zu mögen,"
959,the cat is meowing. he's hungry.,okay. i'll feed him right now.,"er hat es geschafft, die Katze zu mögen,","ich hoffe, ich werde ihn jetzt ernähren."
960,okay. i'll feed him right now.,you shouldn't make him wait.,"ich hoffe, ich werde ihn jetzt ernähren.",Sie sollten ihn nicht warten lassen.
961,you shouldn't make him wait.,i was doing my homework.,Sie sollten ihn nicht warten lassen.,ich habe meine Hausaufgaben gemacht.
962,i was doing my homework.,the cat doesn't care about your homework.,ich habe meine Hausaufgaben gemacht.,die Katze kümmert sich nicht um Ihre Hausaufgaben.
963,the cat doesn't care about your homework.,the cat doesn't care about anything.,die Katze kümmert sich nicht um Ihre Hausaufgaben.,die Katze kümmert sich nicht um etwas.
964,the cat doesn't care about anything.,that's the way cats are.,die Katze kümmert sich nicht um etwas.,"Das ist die Art und Weise, wie Katzen sind."
965,that's the way cats are.,all they think about is themselves.,"Das ist die Art und Weise, wie Katzen sind.",Sie denken nur an sich selbst.
966,all they think about is themselves.,maybe we should get rid of him.,Sie denken nur an sich selbst.,Vielleicht sollten wir ihn loswerden.
967,maybe we should get rid of him.,of course not! he's family.,Vielleicht sollten wir ihn loswerden.,Natürlich nicht!
968,i hate shaving.,me too.,i hate shaving.,Auch ich.
969,me too.,i just cut myself again.,Auch ich.,Ich habe mich gerade wieder geschnitten.
970,i just cut myself again.,did you use a new blade?,Ich habe mich gerade wieder geschnitten.,hatt ihr eine neue Klinge verwendet?
971,did you use a new blade?,"it doesn't matter. old blades cut, new blades cut.",hatt ihr eine neue Klinge verwendet?,"Es spielt keine Rolle, alte Klingen schneiden, neue Klingen schneiden."
972,"it doesn't matter. old blades cut, new blades cut.",maybe you should use an electric shaver.,"Es spielt keine Rolle, alte Klingen schneiden, neue Klingen schneiden.",Vielleicht sollten Sie einen elektrischen Rasierer verwenden.
973,maybe you should use an electric shaver.,"they make a lot of noise, but they don't give a close shave.",Vielleicht sollten Sie einen elektrischen Rasierer verwenden.,"Sehr freundliches Personal, freundliches Personal, freundliches Personal"
974,"they make a lot of noise, but they don't give a close shave.",maybe you should stop shaving.,"Sehr freundliches Personal, freundliches Personal, freundliches Personal","Vielleicht sollten Sie aufhören, zu senken."
975,maybe you should stop shaving.,and grow a beard?,"Vielleicht sollten Sie aufhören, zu senken.",und wachsen Sie einen Bart?
976,and grow a beard?,sure. why not?,und wachsen Sie einen Bart?,Warum nicht?
977,sure. why not?,because food and other stuff sticks in my beard.,Warum nicht?,weil Nahrung und andere Sachen in meinem Bart stecken.
978,because food and other stuff sticks in my beard.,hmm. here's an idea. put cream on your face and have the cat lick it off.,weil Nahrung und andere Sachen in meinem Bart stecken.,hmm. hier ist eine Idee.
979,excuse me.,yes?,Entschuldigen Sie mich.,ja?
980,yes?,are you reading this paper?,ja?,Lesen Sie dieses Papier?
981,are you reading this paper?,"oh, no. help yourself.",Lesen Sie dieses Papier?,"oh, nein, helfen Sie sich selbst."
982,"oh, no. help yourself.",i asked because the paper is sitting next to you.,"oh, nein, helfen Sie sich selbst.","ich fragte, weil das Papier neben Ihnen sitzt."
983,i asked because the paper is sitting next to you.,thank you. that's polite of you to ask.,"ich fragte, weil das Papier neben Ihnen sitzt.","Vielen Dank, das ist höflich von Ihnen zu fragen."
984,thank you. that's polite of you to ask.,some people would just pick it up.,"Vielen Dank, das ist höflich von Ihnen zu fragen.",Einige Leute würden es einfach aufnehmen.
985,some people would just pick it up.,"yes, i know. some people are rude.",Einige Leute würden es einfach aufnehmen.,Einige Leute sind höflich.
986,"yes, i know. some people are rude.",i always try to be polite.,Einige Leute sind höflich.,"ich versuche immer, höflich zu sein."
987,i always try to be polite.,so do i.,"ich versuche immer, höflich zu sein.",so tun i.
988,so do i.,the world needs more polite people like us.,so tun i.,die Welt braucht mehr höfliche Menschen wie wir.
989,the world needs more polite people like us.,i agree 100 percent.,die Welt braucht mehr höfliche Menschen wie wir.,ich stimme 100 Prozent zu.
990,"mom, i want a puppy.",let me think about it.,"Mama, ich will ein Welpen.",Lassen Sie mich darüber nachdenken.
991,let me think about it.,why do you have to think about it?,Lassen Sie mich darüber nachdenken.,Warum müssen Sie darüber nachdenken?
992,why do you have to think about it?,because a puppy costs money.,Warum müssen Sie darüber nachdenken?,weil ein Welpen kosten Geld.
993,because a puppy costs money.,"no, it doesn't. puppies are free.",weil ein Welpen kosten Geld.,"- es ist nicht, welpen sind kostenlos."
994,"no, it doesn't. puppies are free.","yes, but a puppy needs shots.","- es ist nicht, welpen sind kostenlos.","ja, aber ein Welpen braucht Schüsse."
995,"yes, but a puppy needs shots.",shots for what?,"ja, aber ein Welpen braucht Schüsse.",-Schüsse für was?
996,shots for what?,so it won't get sick. just like you get shots.,-Schüsse für was?,"- ich hoffe, es wird nicht krank, sondern"
997,so it won't get sick. just like you get shots.,i hate shots.,"- ich hoffe, es wird nicht krank, sondern",ich hasse Schüsse.
998,i hate shots.,and a puppy eats food. food costs money.,ich hasse Schüsse.,"- es ist ein bisschen süß, aber es ist nicht"
999,and a puppy eats food. food costs money.,no problem. i'll give him food off my plate.,"- es ist ein bisschen süß, aber es ist nicht","ich sage es nicht, ich sage es nicht"
1000,no problem. i'll give him food off my plate.,"oh, no you don't. puppies don't eat vegetables.","ich sage es nicht, ich sage es nicht","oh, nein, es gibt keine Welpen, die nicht Gemüse"
1001,look at all these kittens!,how many are there?,schaut euch all diese Kätzchen an!,Wie viele gibt es?
1002,how many are there?,eight.,Wie viele gibt es?,acht.
1003,eight.,they're all so cute.,acht.,"ich hoffe, ich hoffe, ich hoffe,"
1004,they're all so cute.,"yes, but i can't keep them.","ich hoffe, ich hoffe, ich hoffe,","ja, aber ich kann sie nicht halten."
1005,"yes, but i can't keep them.",what are you going to do with them?,"ja, aber ich kann sie nicht halten.",Was werden Sie mit ihnen tun?
1006,what are you going to do with them?,i'm going to give them away. do you want one?,Was werden Sie mit ihnen tun?,"ich werde sie weggeben, willst du sie?"
1007,i'm going to give them away. do you want one?,"yes, i would love one.","ich werde sie weggeben, willst du sie?","ja, ich würde es lieben."
1008,"yes, i would love one.",which one do you want?,"ja, ich würde es lieben.",welches ist der Wunsch?
1009,which one do you want?,that one. the one that's all black.,welches ist der Wunsch?,Dieser ist schwarz.
1010,that one. the one that's all black.,"yes, i like that one, too.",Dieser ist schwarz.,"ja, ich mag das auch."
1011,"yes, i like that one, too.",i'll call him blacky.,"ja, ich mag das auch.",ich nenne ihn schwarz.
1012,my parents go to church every sunday.,they trust in god.,Meine Eltern gehen jeden Sonntag zur Kirche.,sie vertrauen auf Gott.
1013,they trust in god.,they hope they will go to heaven.,sie vertrauen auf Gott.,"sie hoffen, sie werden zum Himmel gehen."
1014,they hope they will go to heaven.,they probably will.,"sie hoffen, sie werden zum Himmel gehen.",Sie werden es wahrscheinlich tun.
1015,they probably will.,but no one knows for sure.,Sie werden es wahrscheinlich tun.,aber niemand weiß sicher.
1016,but no one knows for sure.,that's for sure.,aber niemand weiß sicher.,Das ist sicher.
1017,that's for sure.,no one knows what happens after we die.,Das ist sicher.,"Niemand weiß, was nach dem Tod geschieht."
1018,no one knows what happens after we die.,"if we are good, we will be happy in heaven with god.","Niemand weiß, was nach dem Tod geschieht.","Wenn wir gut sind, werden wir im Himmel mit Gott glücklich sein."
1019,"if we are good, we will be happy in heaven with god.",that's what many people believe.,"Wenn wir gut sind, werden wir im Himmel mit Gott glücklich sein.","Das ist das, was viele Menschen glauben."
1020,that's what many people believe.,"if we are bad, we will be unhappy forever in hell.","Das ist das, was viele Menschen glauben.","Wenn wir schlecht sind, werden wir uns für immer in der Hölle unglücklich"
1021,"if we are bad, we will be unhappy forever in hell.",i don't want to go to hell.,"Wenn wir schlecht sind, werden wir uns für immer in der Hölle unglücklich",ich will nicht in die Hölle gehen.
1022,i don't want to go to hell.,let's go to church with your parents on sunday.,ich will nicht in die Hölle gehen.,Lassen Sie uns am Sonntag mit Ihren Eltern zur Kirche gehen.
1023,my husband died.,i'm sorry for you.,mein Mann starb.,Leider entschuldige ich mich für Sie.
1024,i'm sorry for you.,thank you.,Leider entschuldige ich mich für Sie.,Vielen Dank.
1025,thank you.,when did he die?,Vielen Dank.,wann er stirbt?
1026,when did he die?,a couple of months ago.,wann er stirbt?,vor ein paar Monaten.
1027,a couple of months ago.,you still miss him.,vor ein paar Monaten.,Sie vermissen ihn noch.
1028,you still miss him.,"yes, but i talk to him almost every day.",Sie vermissen ihn noch.,"ja, aber ich spreche mit ihm fast jeden Tag."
1029,"yes, but i talk to him almost every day.",when you go to church?,"ja, aber ich spreche mit ihm fast jeden Tag.",wenn Sie zur Kirche gehen?
1030,when you go to church?,"no, when i call him on his cell phone.",wenn Sie zur Kirche gehen?,"ich habe es nicht geschafft, ich habe es nicht geschafft"
1031,"no, when i call him on his cell phone.",what do you mean?,"ich habe es nicht geschafft, ich habe es nicht geschafft",Was meinen Sie?
1032,what do you mean?,i buried him with his cell phone.,Was meinen Sie?,ich begrab ihn mit seinem Handy.
1033,i buried him with his cell phone.,what will you do when the battery dies?,ich begrab ihn mit seinem Handy.,"Was wird man tun, wenn die Batterie stirbt?"
1034,today is friday the thirteenth.,that's a bad day.,Heute ist der dreizehnte Freitag.,Das ist ein schlechter Tag.
1035,that's a bad day.,it's supposed to be unlucky.,Das ist ein schlechter Tag.,es soll unglücklich sein.
1036,it's supposed to be unlucky.,you're supposed to stay home all day.,es soll unglücklich sein.,"es ist ziemlich störend, dass man den ganzen Tag zu"
1037,you're supposed to stay home all day.,that's what i do.,"es ist ziemlich störend, dass man den ganzen Tag zu","Das ist es, was ich tun."
1038,that's what i do.,my friend stayed in a hotel on friday the thirteenth.,"Das ist es, was ich tun.","Sehr freundliches Personal, freundliches Personal, freundliches Personal"
1039,my friend stayed in a hotel on friday the thirteenth.,that was a mistake.,"Sehr freundliches Personal, freundliches Personal, freundliches Personal",Das war ein Fehler.
1040,that was a mistake.,he stayed on the thirteenth floor.,Das war ein Fehler.,er blieb im 13. Stock.
1041,he stayed on the thirteenth floor.,what happened?,er blieb im 13. Stock.,Was ist passiert?
1042,what happened?,someone stole his laptop.,Was ist passiert?,jemand stolperte seinen Laptop.
1043,someone stole his laptop.,he was asking for it.,jemand stolperte seinen Laptop.,er hat es gefordert.
1044,he was asking for it.,he learned his lesson. he's home today.,er hat es gefordert.,"er hat seine Lektion gelernt, er ist heute zu Hause."
1045,do you really love me?,of course.,liebt ihr mich wirklich?,Natürlich.
1046,of course.,prove it.,Natürlich.,beweisen.
1047,prove it.,how can i prove it?,beweisen.,Wie kann ich das beweisen?
1048,how can i prove it?,take me to dinner.,Wie kann ich das beweisen?,ich zum Abendessen.
1049,take me to dinner.,that's it? that's all i have to do?,ich zum Abendessen.,"Das ist es, das ist alles, was ich tun muss?"
1050,that's it? that's all i have to do?,"take me to a nice restaurant, not to mcdonald's.","Das ist es, das ist alles, was ich tun muss?","Sehr freundliches Personal, freundliches Personal, freundliches Personal"
1051,"take me to a nice restaurant, not to mcdonald's.",but a nice restaurant costs money.,"Sehr freundliches Personal, freundliches Personal, freundliches Personal",The hotel is very clean and the staff were very helpful.
1052,but a nice restaurant costs money.,"yes, and you have to make a reservation.",The hotel is very clean and the staff were very helpful.,"ja, und Sie müssen eine Reservierung machen."
1053,"yes, and you have to make a reservation.",that's such a hassle.,"ja, und Sie müssen eine Reservierung machen.",Das ist so mühsam.
1054,that's such a hassle.,i knew you didn't love me.,Das ist so mühsam.,"ich wusste, dass du mich nicht liebest."
1055,i knew you didn't love me.,"okay, okay! i'll make a reservation right now.","ich wusste, dass du mich nicht liebest.","Sehr freundliches Personal, freundliches Personal, freundliches Personal"
1056,my parents are divorced.,so are mine.,Meine Eltern sind ehemals.,Das sind meine.
1057,so are mine.,why did your parents get divorced?,Das sind meine.,Warum haben Ihre Eltern Scheidung?
1058,why did your parents get divorced?,my father found a new girlfriend.,Warum haben Ihre Eltern Scheidung?,mein Vater fand eine neue Freundin.
1059,my father found a new girlfriend.,that's too bad.,mein Vater fand eine neue Freundin.,Das ist zu schlecht.
1060,that's too bad.,my mother was hurt and angry.,Das ist zu schlecht.,Meine Mutter war schmerzt und wütend.
1061,my mother was hurt and angry.,she had good reason. what did she do?,Meine Mutter war schmerzt und wütend.,"Sie hatte gute Gründe, was sie getan hat?"
1062,she had good reason. what did she do?,she told him to drop his girlfriend.,"Sie hatte gute Gründe, was sie getan hat?","Sie sagte ihm, seine Freundin zu entlassen."
1063,she told him to drop his girlfriend.,what did your father do?,"Sie sagte ihm, seine Freundin zu entlassen.",Was hat Ihr Vater getan?
1064,what did your father do?,he moved out of our house.,Was hat Ihr Vater getan?,er zog aus unserem Haus.
