Unnamed: 0,question,answer,questions_german,answers_german
1776,were you in a crosswalk?,"yes, but the red hand was blinking.",waren Sie in einem Scheideweg?,"ja, aber die rote Hand blinkte."
1777,"yes, but the red hand was blinking.",so? that's a ticket?,"ja, aber die rote Hand blinkte.",- es ist ein Ticket?
1778,so? that's a ticket?,"yes, it's a $140 ticket.",- es ist ein Ticket?,"ja, es ist ein Ticket von 140 $."
1779,"yes, it's a $140 ticket.",that's not right!,"ja, es ist ein Ticket von 140 $.",Das ist nicht richtig!
1780,that's not right!,"when i started to cross the street, the white walk sign was blinking.",Das ist nicht richtig!,"Sehr freundliches Personal, freundliches Personal, freundliches Personal"
1781,"when i started to cross the street, the white walk sign was blinking.",you need to walk faster.,"Sehr freundliches Personal, freundliches Personal, freundliches Personal",Sie müssen schneller gehen.
1782,you're driving too fast.,why do you say that?,Sie fahren zu schnell.,Warum sagen Sie das?
1783,why do you say that?,the speed limit is 65.,Warum sagen Sie das?,die Geschwindigkeitsgrenze beträgt 65.
1784,the speed limit is 65.,i know that.,die Geschwindigkeitsgrenze beträgt 65.,Ich weiß das.
1785,i know that.,but you're doing 75.,Ich weiß das.,", aber Sie tun 75."
1786,but you're doing 75.,so is everyone else.,", aber Sie tun 75.",Dasselbe gilt für alle anderen.
1787,so is everyone else.,but a cop might stop you.,Dasselbe gilt für alle anderen.,aber ein Cop könnte Sie stoppen.
1788,but a cop might stop you.,"no, he won't. some cars are doing 85.",aber ein Cop könnte Sie stoppen.,Einige Autos machen 85.
1789,"no, he won't. some cars are doing 85.",so the cop will stop those cars?,Einige Autos machen 85.,so wird der Cop diese Autos stoppen?
1790,so the cop will stop those cars?,of course. he stops the fastest cars.,so wird der Cop diese Autos stoppen?,er hält natürlich die schnellsten Autos.
1791,of course. he stops the fastest cars.,my friend got a ticket for doing 75.,er hält natürlich die schnellsten Autos.,ich habe ein Ticket für 75.
1792,my friend got a ticket for doing 75.,your friend was unlucky.,ich habe ein Ticket für 75.,Ihr Freund war unglücklich.
1793,remember to put air in your tires.,how often do i have to do that?,"denken Sie daran, Luft in Ihre Reifen zu setzen.",Wie oft muss ich das tun?
1794,how often do i have to do that?,once every two months.,Wie oft muss ich das tun?,einmal alle zwei Monate.
1795,once every two months.,that's a lot.,einmal alle zwei Monate.,Das ist viel.
1796,that's a lot.,what do you mean?,Das ist viel.,Was meinen Sie?
1797,what do you mean?,that's six times a year!,Was meinen Sie?,Das ist sechs Mal im Jahr!
1798,that's six times a year!,"yes, and it takes about five minutes each time.",Das ist sechs Mal im Jahr!,"ja, und es dauert etwa fünf Minuten jedes Mal."
1799,"yes, and it takes about five minutes each time.",i'll try.,"ja, und es dauert etwa fünf Minuten jedes Mal.",ich werde versuchen.
1800,i'll try.,check your tires or you'll get a flat.,ich werde versuchen.,Prüfen Sie Ihre Reifen oder Sie erhalten eine Wohnung.
1801,check your tires or you'll get a flat.,oh. that's not good.,Prüfen Sie Ihre Reifen oder Sie erhalten eine Wohnung.,"oh, das ist nicht gut."
1802,oh. that's not good.,"no, it isn't. a flat costs you time and money.","oh, das ist nicht gut.","Leider ist es nicht so, eine Wohnung kostet Zeit und Geld."
1803,"no, it isn't. a flat costs you time and money.",and i don't have either.,"Leider ist es nicht so, eine Wohnung kostet Zeit und Geld.",ich habe auch keinen.
1804,you're driving too fast.,i'm in a hurry.,Sie fahren zu schnell.,ich bin in einer Eile.
1805,i'm in a hurry.,don't ever be in a hurry.,ich bin in einer Eile.,seid nicht in Eile.
1806,don't ever be in a hurry.,it's not my fault. you didn't wake me up.,seid nicht in Eile.,"ich habe nicht daran schuld, ich habe mich nicht aufgewacht."
1807,it's not my fault. you didn't wake me up.,that's not my fault. you didn't tell me to wake you up.,"ich habe nicht daran schuld, ich habe mich nicht aufgewacht.","Das ist nicht meine Schuld, Sie haben mir nicht gesagt, Sie aufzuwachen."
1808,that's not my fault. you didn't tell me to wake you up.,"well, i meant to.","Das ist nicht meine Schuld, Sie haben mir nicht gesagt, Sie aufzuwachen.",ich habe es gesagt.
1809,"well, i meant to.",don't ever be in a hurry when you're driving.,ich habe es gesagt.,"fahren Sie nicht in Eile, wenn Sie fahren."
1810,don't ever be in a hurry when you're driving.,why not?,"fahren Sie nicht in Eile, wenn Sie fahren.",Warum nicht?
1811,why not?,because you'll have an accident. most accidents are because people are in a hurry.,Warum nicht?,"Die meisten Unfälle sind deshalb, weil die Menschen sich eilen."
1812,because you'll have an accident. most accidents are because people are in a hurry.,how do you know that?,"Die meisten Unfälle sind deshalb, weil die Menschen sich eilen.",Wie wissen Sie das?
1813,how do you know that?,i read a lot.,Wie wissen Sie das?,ich habe viel gelesen.
1814,i read a lot.,i thought drunks caused most accidents.,ich habe viel gelesen.,"ich dachte, dass betrunkene Unfälle die meisten Unfälle verursachten"
1815,let's go for a ride.,where are we going?,- es gibt keinen großen großen großen großen großen,Wohin gehen wir?
1816,where are we going?,into the mountains.,Wohin gehen wir?,in die Berge.
1817,into the mountains.,that sounds nice.,in die Berge.,Das klingt schön.
1818,that sounds nice.,i want to show you my new car.,Das klingt schön.,ich möchte Ihnen mein neues Auto zeigen.
1819,i want to show you my new car.,you bought a new car?,ich möchte Ihnen mein neues Auto zeigen.,Sie haben ein neues Auto gekauft?
1820,you bought a new car?,yes. i bought a cadillac.,Sie haben ein neues Auto gekauft?,ich habe ein cadillac gekauft.
1821,yes. i bought a cadillac.,a luxury car.,ich habe ein cadillac gekauft.,"Sehr freundliches Personal, freundliches Personal, freundliches Personal"
1822,a luxury car.,luxury plus speed.,"Sehr freundliches Personal, freundliches Personal, freundliches Personal",Luxus plus Geschwindigkeit.
1823,luxury plus speed.,what are we waiting for?,Luxus plus Geschwindigkeit.,Was warten wir auf?
1824,what are we waiting for?,let me get the keys.,Was warten wir auf?,Lassen Sie mich die Schlüssel bekommen.
1825,let me get the keys.,let me get my camera.,Lassen Sie mich die Schlüssel bekommen.,Ich lasse mich meine Kamera ansehen.
1826,i have to go to the bathroom.,why didn't you go before we left?,The room was very clean and the room was very clean.,Warum sind Sie nicht vor der Abreise?
1827,why didn't you go before we left?,"i did, but i have to go again.",Warum sind Sie nicht vor der Abreise?,"ich habe es getan, aber ich muss wieder gehen."
1828,"i did, but i have to go again.","well, hold on a little longer.","ich habe es getan, aber ich muss wieder gehen.","es ist gut, halten Sie ein wenig länger."
1829,"well, hold on a little longer.",i think i'm going to explode.,"es ist gut, halten Sie ein wenig länger.","ich glaube, ich werde explodieren."
1830,i think i'm going to explode.,just hold on.,"ich glaube, ich werde explodieren.",haltet einfach weiter.
1831,just hold on.,oh! don't hit any more bumps!,haltet einfach weiter.,"oh, treffen Sie keinen weiteren Blitz!"
1832,oh! don't hit any more bumps!,we'll be at mcdonald's in just a few minutes.,"oh, treffen Sie keinen weiteren Blitz!",mcdonald's wird in wenigen Minuten sein.
1833,we'll be at mcdonald's in just a few minutes.,i hope they are fast minutes.,mcdonald's wird in wenigen Minuten sein.,"ich hoffe, sie sind schnelle Minuten."
1834,i hope they are fast minutes.,think about something else. think about a hamburger.,"ich hoffe, sie sind schnelle Minuten.","denken Sie an etwas anderes, denken Sie an einen Hamburger."
1835,think about something else. think about a hamburger.,"i'm thinking, but i still have to go.","denken Sie an etwas anderes, denken Sie an einen Hamburger.","ich denke, aber ich muss noch gehen."
1836,"i'm thinking, but i still have to go.",it's the next exit. hold on!,"ich denke, aber ich muss noch gehen.","es ist die nächste Ausfahrt, halten Sie an!"
1837,where's the car?,what do you mean?,wo ist das Auto?,Was meinen Sie?
1838,what do you mean?,the car isn't here.,Was meinen Sie?,Das Auto ist nicht hier.
1839,the car isn't here.,where did you park it?,Das Auto ist nicht hier.,Wo haben Sie es parkt?
1840,where did you park it?,i parked it right here.,Wo haben Sie es parkt?,ich habe es hier gefahren.
1841,i parked it right here.,are you sure?,ich habe es hier gefahren.,sind Sie sicher?
1842,are you sure?,yes. i remember this big tree.,sind Sie sicher?,ich erinnere mich an diesen großen Baum.
1843,yes. i remember this big tree.,maybe it's the wrong tree.,ich erinnere mich an diesen großen Baum.,vielleicht ist es der falsche Baum.
1844,maybe it's the wrong tree.,"no, this is the tree.",vielleicht ist es der falsche Baum.,"Nein, das ist der Baum."
1845,"no, this is the tree.",did someone steal it?,"Nein, das ist der Baum.",hat jemand es gestohlen?
1846,did someone steal it?,i sure hope not.,hat jemand es gestohlen?,Ich hoffe sicher nicht.
1847,i sure hope not.,maybe they towed it away.,Ich hoffe sicher nicht.,Vielleicht haben sie es weggeworfen.
1848,look at this traffic.,i'd rather not.,schauen Sie sich diesen Verkehr an.,Leider hat man es nicht geschafft.
1849,i'd rather not.,it gets worse every year.,Leider hat man es nicht geschafft.,es verschlimmert sich jedes Jahr.
1850,it gets worse every year.,why are you complaining? we're going almost 20 miles an hour.,es verschlimmert sich jedes Jahr.,Warum klagen Sie sich?
1851,why are you complaining? we're going almost 20 miles an hour.,the speed limit is 65!,Warum klagen Sie sich?,die Geschwindigkeitsgrenze beträgt 65!
1852,the speed limit is 65!,"well, that's between 2:00 and 4:00 a.m.",die Geschwindigkeitsgrenze beträgt 65!,es ist zwischen 2:00 und 4:00 Uhr.
1853,"well, that's between 2:00 and 4:00 a.m.",where are all these people going?,es ist zwischen 2:00 und 4:00 Uhr.,Wohin gehen alle diese Menschen?
1854,where are all these people going?,they're all asking the same question.,Wohin gehen alle diese Menschen?,Sie alle stellen die gleiche Frage.
1855,they're all asking the same question.,when are they going to fix this problem?,Sie alle stellen die gleiche Frage.,wann werden sie dieses Problem beheben?
1856,when are they going to fix this problem?,they said they need more money.,wann werden sie dieses Problem beheben?,"Sie sagten, sie benötigen mehr Geld."
1857,they said they need more money.,they always need more money.,"Sie sagten, sie benötigen mehr Geld.",sie brauchen immer mehr Geld.
1858,they always need more money.,it'll get worse before it gets better.,sie brauchen immer mehr Geld.,"es wird sich verschlimmern, bevor es besser wird."
1859,did you see that car?,"yes, he went through the red light.",hatt ihr dieses Auto gesehen?,"ja, er hat das rote Licht durchgelaufen."
1860,"yes, he went through the red light.",can we call the police?,"ja, er hat das rote Licht durchgelaufen.",Können wir die Polizei anrufen?
1861,can we call the police?,"no, the police don't care.",Können wir die Polizei anrufen?,"Nein, die Polizei kümmert sich nicht."
1862,"no, the police don't care.",why not?,"Nein, die Polizei kümmert sich nicht.",Warum nicht?
1863,why not?,they have to see it happen.,Warum nicht?,"sie müssen sehen, dass es geschehen wird."
1864,they have to see it happen.,they don't believe us?,"sie müssen sehen, dass es geschehen wird.",sie glauben uns nicht?
1865,they don't believe us?,no. they can only give a ticket if they see it happen.,sie glauben uns nicht?,"Nein, sie können nur ein Ticket geben, wenn sie sehen, dass es"
1866,no. they can only give a ticket if they see it happen.,"so, what do we do?","Nein, sie können nur ein Ticket geben, wenn sie sehen, dass es","Also, was tun wir?"
1867,"so, what do we do?",we don't do anything.,"Also, was tun wir?",Wir tun nichts.
1868,we don't do anything.,maybe we should honk the horn next time.,Wir tun nichts.,Vielleicht sollten wir das nächste Mal das Horn hüllen.
1869,maybe we should honk the horn next time.,the driver will just honk back at us.,Vielleicht sollten wir das nächste Mal das Horn hüllen.,der Fahrer wird uns nur wieder hünken.
1870,my car is dirty.,why don't you wash it?,ich habe ein Auto schmutzig.,Warum waschen Sie es nicht?
1871,why don't you wash it?,that's what i'm going to do.,Warum waschen Sie es nicht?,"Das ist es, was ich tun werde."
1872,that's what i'm going to do.,are you going to wash it yourself?,"Das ist es, was ich tun werde.",Werden Sie es selbst waschen?
1873,are you going to wash it yourself?,of course. it's not a hard job.,Werden Sie es selbst waschen?,Natürlich ist es nicht eine harte Aufgabe.
1874,of course. it's not a hard job.,i'll help you.,Natürlich ist es nicht eine harte Aufgabe.,ich werde Ihnen helfen.
1875,i'll help you.,"okay, i'll get a bucket.",ich werde Ihnen helfen.,"ich hoffe, ich werde einen Eimer bekommen."
1876,"okay, i'll get a bucket.",i'll rinse the car first.,"ich hoffe, ich werde einen Eimer bekommen.",ich sage das Auto zunächst.
1877,i'll rinse the car first.,then we can scrub it with a wet sponge and soap.,ich sage das Auto zunächst.,dann können wir es mit einem Nassschamm und Seife s
1878,then we can scrub it with a wet sponge and soap.,"after that, we can dry it with a towel.",dann können wir es mit einem Nassschamm und Seife s,danach können wir es mit einem Handtuch trockenen.
1879,"after that, we can dry it with a towel.",then it will look like new,danach können wir es mit einem Handtuch trockenen.,dann sieht es wie neu aus.
1880,then it will look like new,and you save $10.,dann sieht es wie neu aus.,und Sie sparen 10 $.
1881,it sure is windy today.,paper is flying everywhere.,es ist heute sicher windig.,Papier fliegt überall.
1882,paper is flying everywhere.,this wind is dangerous for drivers.,Papier fliegt überall.,dieser Wind ist gefährlich für die Fahrer.
1883,this wind is dangerous for drivers.,especially for drivers of big trucks.,dieser Wind ist gefährlich für die Fahrer.,besonders für die Fahrer von großen LKWs.
1884,especially for drivers of big trucks.,the wind blows those trucks over.,besonders für die Fahrer von großen LKWs.,der Wind bläst diese LKW über.
1885,the wind blows those trucks over.,"it blows trees over, too.",der Wind bläst diese LKW über.,es bläst auch Bäume über.
1886,"it blows trees over, too.",a tree fell onto my dad's car.,es bläst auch Bäume über.,hat ein Baum auf mein Vater's Auto gefallen.
1887,a tree fell onto my dad's car.,was there much damage?,hat ein Baum auf mein Vater's Auto gefallen.,hat es viel Schaden gegeben?
1888,was there much damage?,my dad had to buy a new car.,hat es viel Schaden gegeben?,ich hatte ein neues Auto gekauft.
1889,my dad had to buy a new car.,wow! that's terrible.,ich hatte ein neues Auto gekauft.,Sehr schrecklich!
1890,wow! that's terrible.,never park your car under a tree.,Sehr schrecklich!,Parken Sie Ihr Auto nie unter einem Baum.
1891,never park your car under a tree.,"the wind will get you, or the birds will get you.",Parken Sie Ihr Auto nie unter einem Baum.,"Der Wind wird Sie bekommen, oder die Vögel werden Sie."
1892,when are we going to stop?,we'll stop at the next mcdonald's.,wann werden wir aufhören?,Wir hören an der nächsten mcdonald's.
1893,we'll stop at the next mcdonald's.,how far away is that?,Wir hören an der nächsten mcdonald's.,Wie weit ist das?
1894,how far away is that?,i think we'll be there in half an hour.,Wie weit ist das?,"ich denke, wir werden in einer halben Stunde dort sein."
1895,i think we'll be there in half an hour.,i hope so. i have to go to the bathroom.,"ich denke, wir werden in einer halben Stunde dort sein.",The room was very clean and the room was very clean.
1896,i hope so. i have to go to the bathroom.,"well, i can always pull over.",The room was very clean and the room was very clean.,ich kann mich immer ziehen.
1897,"well, i can always pull over.","no, thank you, i'll just wait.",ich kann mich immer ziehen.,"ne, vielen Dank, ich werde nur warten."
1898,"no, thank you, i'll just wait.",we can kill two birds with one stone.,"ne, vielen Dank, ich werde nur warten.",wir können zwei Vögel mit einem Stein töten.
1899,we can kill two birds with one stone.,what do you mean?,wir können zwei Vögel mit einem Stein töten.,Was meinen Sie?
1900,what do you mean?,"while you're using the bathroom, i'll order some food.",Was meinen Sie?,The hotel is very clean and the staff were very helpful.
1901,"while you're using the bathroom, i'll order some food.",don't order for me. i'm not hungry.,The hotel is very clean and the staff were very helpful.,"ich habe keinen guten Eindruck, ich habe keinen großen Hunger."
1902,don't order for me. i'm not hungry.,"i'm very hungry. i'll order for you, and then i'll eat yours.","ich habe keinen guten Eindruck, ich habe keinen großen Hunger.","Ich bin sehr hungrig, ich werde für Sie bestellen und dann essen Sie Ihre"
1903,this is such a long light.,look how many cars are waiting in line.,Das ist ein so langes Licht.,"Schauen Sie sich an, wie viele Autos warten in der Reihe."
1904,look how many cars are waiting in line.,they need a left-turn arrow.,"Schauen Sie sich an, wie viele Autos warten in der Reihe.",sie benötigen einen linken Pfeil.
1905,they need a left-turn arrow.,only two cars can make a left turn every three or four minutes.,sie benötigen einen linken Pfeil.,Nur zwei Autos können alle drei oder vier Minuten eine linke Runde machen.
1906,only two cars can make a left turn every three or four minutes.,we'll be here forever.,Nur zwei Autos können alle drei oder vier Minuten eine linke Runde machen.,Wir werden hier für immer sein.
1907,we'll be here forever.,get out of this lane.,Wir werden hier für immer sein.,"- es ist ziemlich störend, dass man es"
1908,get out of this lane.,but we need to turn left.,"- es ist ziemlich störend, dass man es",Allerdings müssen wir uns links wenden.
1909,but we need to turn left.,forget it. go straight.,Allerdings müssen wir uns links wenden.,"Dabei muß man es vergessen, es muß gerade gehen"
1910,forget it. go straight.,then what?,"Dabei muß man es vergessen, es muß gerade gehen",dann was?
1911,then what?,then we'll just make a u-turn.,dann was?,dann machen wir einfach eine U-Kehr.
1912,then we'll just make a u-turn.,and then we can turn right at the light.,dann machen wir einfach eine U-Kehr.,und dann können wir rechts an der Lichter drehen.
1913,and then we can turn right at the light.,good idea. it will be so much quicker.,und dann können wir rechts an der Lichter drehen.,"Sehr gute Idee, es wird so viel schneller sein."
1914,i need a cheap car.,how much money do you have?,The hotel is very clean and the staff are very helpful.,Wie viel Geld haben Sie?
1915,how much money do you have?,"$1,000.",Wie viel Geld haben Sie?,1.000 Dollar.
1916,"$1,000.","well, that should get you something.",1.000 Dollar.,"es ist gut, das sollte Sie etwas bringen."
1917,"well, that should get you something.",but i need something that's reliable.,"es ist gut, das sollte Sie etwas bringen.",ich wünsche mir eine gute Leistung.
1918,but i need something that's reliable.,you need a car with low mileage.,ich wünsche mir eine gute Leistung.,Sie benötigen ein Auto mit geringer Meilen.
1919,you need a car with low mileage.,a car that was owned by a little old lady.,Sie benötigen ein Auto mit geringer Meilen.,"Sehr freundliches Personal, freundliches Personal, freundliches Personal"
1920,a car that was owned by a little old lady.,where have you looked?,"Sehr freundliches Personal, freundliches Personal, freundliches Personal",Wo haben Sie gesehen?
1921,where have you looked?,i haven't looked anywhere yet.,Wo haben Sie gesehen?,ich habe noch nicht gesehen.
1922,i haven't looked anywhere yet.,why not?,ich habe noch nicht gesehen.,Warum nicht?
1923,why not?,because i'll never find one for such a low price.,Warum nicht?,"Sehr freundliches Personal, freundliches Personal, hilfsbereite"
1924,because i'll never find one for such a low price.,you're right about that. keep saving your money.,"Sehr freundliches Personal, freundliches Personal, hilfsbereite","Sie haben Recht, sparen Sie immer Ihr Geld."
1925,"good afternoon, officer.","your driver's license and registration, please.","guter Nachmittag, Offizier.","Ihren Führerschein und Ihre Registrierung, bitte."
1926,"your driver's license and registration, please.",here you go.,"Ihren Führerschein und Ihre Registrierung, bitte.",Hier geht es.
1927,here you go.,do you know why i pulled you over?,Hier geht es.,"wüsstet du, warum ich dich überzogen habe?"
1928,do you know why i pulled you over?,i have no idea. all of a sudden i heard your siren.,"wüsstet du, warum ich dich überzogen habe?","Ich habe keine Ahnung, plötzlich habe ich Ihre Sirene gehört."
1929,i have no idea. all of a sudden i heard your siren.,you rolled through that stop sign back there.,"Ich habe keine Ahnung, plötzlich habe ich Ihre Sirene gehört.",Sie wandten durch dieses Stop-Schild zurück.
1930,you rolled through that stop sign back there.,but i stopped!,Sie wandten durch dieses Stop-Schild zurück.,ich habe nicht mehr schlafen lassen.
1931,but i stopped!,"no, you didn't. you slowed down, but you didn't come to a full stop.",ich habe nicht mehr schlafen lassen.,"Leider hat man sich nicht verlangsamt, aber man hat nicht an einen"
1932,"no, you didn't. you slowed down, but you didn't come to a full stop.","well, nobody else does, so why should i?","Leider hat man sich nicht verlangsamt, aber man hat nicht an einen",Warum sollte ich also nicht meinen?
1933,"well, nobody else does, so why should i?",that's not the attitude of a good driver.,Warum sollte ich also nicht meinen?,das ist nicht die Haltung eines guten Fahrers.
1934,that's not the attitude of a good driver.,but i am a good driver. i've never had a ticket in my life.,das ist nicht die Haltung eines guten Fahrers.,ich habe nie ein Ticket in meinem Leben.
1935,but i am a good driver. i've never had a ticket in my life.,"well, you've got one now. here. have a nice day.",ich habe nie ein Ticket in meinem Leben.,"ich hoffe, ich hoffe, ich hoffe,"
1936,$140. i can't believe it.,what are you talking about?,"Etwas spürbar, aber ich habe es nicht gesehen",wovon sprechen Sie?
1937,what are you talking about?,i got a ticket downtown for $140.,wovon sprechen Sie?,The hotel is very close to the city centre and the city centre.
1938,i got a ticket downtown for $140.,were you speeding?,The hotel is very close to the city centre and the city centre.,hatt ihr sich beschleunigt?
1939,were you speeding?,"no, i was crossing the street.",hatt ihr sich beschleunigt?,"Leider war es nicht so gut, dass man die Straße überquer"
1940,"no, i was crossing the street.",were you jaywalking?,"Leider war es nicht so gut, dass man die Straße überquer",hatt ihr jaywalking?
1941,were you jaywalking?,"no, i was in the crosswalk.",hatt ihr jaywalking?,Leider war ich nicht in der Nähe.
1942,"no, i was in the crosswalk.",so why did you get a ticket?,Leider war ich nicht in der Nähe.,Warum also haben Sie ein Ticket bekommen?
1943,so why did you get a ticket?,the officer said the red hand was blinking.,Warum also haben Sie ein Ticket bekommen?,"Der Offizier sagte, die rote Hand blitze."
1944,the officer said the red hand was blinking.,was it blinking when you entered the crosswalk?,"Der Offizier sagte, die rote Hand blitze.","war es blinkend, als Sie in den Kreuzweg eingestiegen sind?"
1945,was it blinking when you entered the crosswalk?,"no, the white walk sign was blinking.","war es blinkend, als Sie in den Kreuzweg eingestiegen sind?","ne, das weiße Spazierzeichen blinkte."
1946,"no, the white walk sign was blinking.",you should fight that ticket. i'll be your witness.,"ne, das weiße Spazierzeichen blinkte.","ich sage es, wenn ich es erhalte,"
1947,they were in a crosswalk near school at 3 a.m.,who?,") hat es sich ereignet, die ersten ersten ersten",Wer?
1948,who?,two students from usc.,Wer?,zwei Studenten aus usc.
1949,two students from usc.,what happened?,zwei Studenten aus usc.,Was ist passiert?
1950,what happened?,"a speeding car ran a red light, killing the girl.",Was ist passiert?,"ein drehendes Auto fuhr ein rotes Licht, das das Mädchen t"
1951,"a speeding car ran a red light, killing the girl.",what happened to the other student?,"ein drehendes Auto fuhr ein rotes Licht, das das Mädchen t",Was passierte mit dem anderen Studenten?
1952,what happened to the other student?,he landed on the hood of the car.,Was passierte mit dem anderen Studenten?,er landete auf der Kappe des Autos.
1953,he landed on the hood of the car.,did he get off the hood?,er landete auf der Kappe des Autos.,Hat er die Kapuze ausgelöst?
1954,did he get off the hood?,"no, the car stopped and the passenger pushed the injured student off the hood.",Hat er die Kapuze ausgelöst?,"Nein, das Auto hielt ein und der Passagier strebt"
1955,"no, the car stopped and the passenger pushed the injured student off the hood.",i'll bet the car continued on its way.,"Nein, das Auto hielt ein und der Passagier strebt","ich wette, dass das Auto weiter auf dem Weg war."
1956,i'll bet the car continued on its way.,of course it did. why stop after you've run over two people?,"ich wette, dass das Auto weiter auf dem Weg war.","Warum hört man auf, nachdem man zwei Leute gefahren ist?"
