Unnamed: 0,question,answer,questions_german,answers_german
2817,all night long we heard people snoring.,housekeeping didn't give us fresh towels.,Während der ganzen Nacht hörten wir Leute schnorcheln.,The hotel is very quiet and the staff were very helpful.
2818,housekeeping didn't give us fresh towels.,room service brought us a cold dinner.,The hotel is very quiet and the staff were very helpful.,The hotel was very clean and the staff were very helpful.
2819,room service brought us a cold dinner.,our nonsmoking room stunk of cigarette smoke.,The hotel was very clean and the staff were very helpful.,"Sehr freundliches Personal, freundliches Personal, freundliches Personal"
2820,our nonsmoking room stunk of cigarette smoke.,our room was right next to the elevator and the ice machine.,"Sehr freundliches Personal, freundliches Personal, freundliches Personal",The hotel was very clean and the staff were very helpful.
2821,our room was right next to the elevator and the ice machine.,they added phony charges to our bill.,The hotel was very clean and the staff were very helpful.,The hotel is very clean and the staff were very helpful.
2822,they added phony charges to our bill.,how did we end up in that terrible hotel?,The hotel is very clean and the staff were very helpful.,The hotel is very clean and the staff are very helpful.
2823,how did we end up in that terrible hotel?,the travel agent gave us a 50-percent discount!,The hotel is very clean and the staff are very helpful.,hat uns der Reisebüro einen Rabatt von 50 Prozent gegeben!
2824,i have to hang up. i'm so sleepy.,it's not even 10 o'clock.,"ich muß hängen, ich bin so schlafend.",es ist nicht einmal 10 Uhr.
2825,it's not even 10 o'clock.,i'm falling asleep on the phone.,es ist nicht einmal 10 Uhr.,ich bin schlafen auf dem Telefon.
2826,i'm falling asleep on the phone.,you got up real early.,ich bin schlafen auf dem Telefon.,Sie sind schon früh aufgehoben.
2827,you got up real early.,i had to take my friend to the airport.,Sie sind schon früh aufgehoben.,The hotel is very clean and the staff were very helpful.
2828,i had to take my friend to the airport.,why didn't you take a nap when you got home?,The hotel is very clean and the staff were very helpful.,"Warum hat man nicht eine nappen, als man nach Hause kam?"
2829,why didn't you take a nap when you got home?,i didn't get home until 30 minutes ago.,"Warum hat man nicht eine nappen, als man nach Hause kam?",ich habe erst vor 30 Minuten nach Hause gekommen.
2830,i didn't get home until 30 minutes ago.,why is that?,ich habe erst vor 30 Minuten nach Hause gekommen.,Warum?
2831,why is that?,there was a bomb threat at the airport.,Warum?,Es gab eine Bombendrohung am Flughafen.
2832,there was a bomb threat at the airport.,only a threat?,Es gab eine Bombendrohung am Flughafen.,nur eine Bedrohung?
2833,only a threat?,"yes, but i was stuck there all day while they looked for the bomb.",nur eine Bedrohung?,"ich habe mich zwar nicht entschlossen, aber ich war den ganzen Tag"
2834,"yes, but i was stuck there all day while they looked for the bomb.",someday the bomb is going to be for real.,"ich habe mich zwar nicht entschlossen, aber ich war den ganzen Tag",irgendwann wird die Bombe für echtes sein.
2835,"my dad went to washington, d.c.",why did he do that?,"ich war in Washington, D.C.",Warum hat er das getan?
2836,why did he do that?,"he was invited, along with about 90 other veterans.",Warum hat er das getan?,"er wurde eingeladen, zusammen mit etwa 90 anderen Veteranen."
2837,"he was invited, along with about 90 other veterans.",who invited them?,"er wurde eingeladen, zusammen mit etwa 90 anderen Veteranen.",wer hat sie eingeladen?
2838,who invited them?,some private organization.,wer hat sie eingeladen?,Einige private Organisation.
2839,some private organization.,why did they invite him?,Einige private Organisation.,Warum hat man ihn eingeladen?
2840,why did they invite him?,to thank him and all the other soldiers who served in world war ii.,Warum hat man ihn eingeladen?,", ihm und allen anderen Soldaten zu danken, die im Weltkrieg ii"
2841,to thank him and all the other soldiers who served in world war ii.,that's very nice.,", ihm und allen anderen Soldaten zu danken, die im Weltkrieg ii",Das ist sehr schön.
2842,that's very nice.,my dad got to see the beautiful new world war ii monument.,Das ist sehr schön.,Mein Vater hat das schöne neue Weltkriegsdenkmal zu sehen.
2843,my dad got to see the beautiful new world war ii monument.,that trip must have cost a lot of money. ,Mein Vater hat das schöne neue Weltkriegsdenkmal zu sehen.,dieser Reise muss viel Geld gekostet haben.
2844,that trip must have cost a lot of money. ,he said all the money came from private donations.,dieser Reise muss viel Geld gekostet haben.,"er sagte, dass das gesamte Geld aus privaten Spenden stammte."
2845,"that was a great trip to washington, d.c.","tell me about it, dad.","Sehr freundliches Personal, freundliches Personal, zentrale Lage, gute","erzählen Sie mir davon, Vater."
2846,"tell me about it, dad.",about 90 of us world war ii veterans got on the plane at 8 a.m.,"erzählen Sie mir davon, Vater.",Etwa 90 von uns Weltkriegsvätern kamen um 8.00 Uhr auf
2847,about 90 of us world war ii veterans got on the plane at 8 a.m.,how long was the flight?,Etwa 90 von uns Weltkriegsvätern kamen um 8.00 Uhr auf,Wie lange war der Flug?
2848,how long was the flight?,it only took about two hours.,Wie lange war der Flug?,es dauerte nur etwa zwei Stunden.
2849,it only took about two hours.,did you take pictures at the world war ii monument?,es dauerte nur etwa zwei Stunden.,Haben Sie Fotos im Weltkriegsdenkmal gemacht?
2850,did you take pictures at the world war ii monument?,"oh, yes. we all took lots of pictures.",Haben Sie Fotos im Weltkriegsdenkmal gemacht?,"oh, ja, wir alle haben viele Bilder genommen."
2851,"oh, yes. we all took lots of pictures.",then you flew back home that evening?,"oh, ja, wir alle haben viele Bilder genommen.",dann fliegt ihr an diesem Abend zurück nach Hause?
2852,then you flew back home that evening?,"yes. when we landed, tv reporters and the army band were there.",dann fliegt ihr an diesem Abend zurück nach Hause?,"Ja, als wir landeten, waren Fernsehberichterstatter und die Armeeband"
2853,"yes. when we landed, tv reporters and the army band were there.",that must have made you feel really special.,"Ja, als wir landeten, waren Fernsehberichterstatter und die Armeeband",", dass Sie sich wirklich besonders fühlen müssen."
2854,that must have made you feel really special.,"oh, it did. there were about 300 people there to honor us.",", dass Sie sich wirklich besonders fühlen müssen.","oh, es hat es getan. es gab"
2855,"oh, it did. there were about 300 people there to honor us.","well, you all deserve it. you helped save our country.","oh, es hat es getan. es gab","Sie alle verdienen es, Sie haben dazu beigetragen, unser Land zu ret"
2856,i need a job.,i thought you had a job.,Ich brauche einen Job.,i thought you had a job.
2857,i thought you had a job.,i did.,i thought you had a job.,ich habe es getan.
2858,i did.,what happened?,ich habe es getan.,Was ist passiert?
2859,what happened?,i got laid off.,Was ist passiert?,ich bin entlassen.
2860,i got laid off.,that's terrible! when did it happen?,ich bin entlassen.,"Leider ist es nicht so schrecklich, wann es"
2861,that's terrible! when did it happen?,i got laid off last week.,"Leider ist es nicht so schrecklich, wann es",ich bin letzte Woche entlassen.
2862,i got laid off last week.,just you?,ich bin letzte Woche entlassen.,nur Sie?
2863,just you?,"no, ten of my coworkers got laid off, too.",nur Sie?,"Nein, auch zehn meiner Mitarbeiter wurden entlassen."
2864,"no, ten of my coworkers got laid off, too.",what are you going to do?,"Nein, auch zehn meiner Mitarbeiter wurden entlassen.",Was werden Sie tun?
2865,what are you going to do?,i'm looking in the newspaper for a job.,Was werden Sie tun?,ich suche in der Zeitung nach einem Job.
2866,i'm looking in the newspaper for a job.,good luck!,ich suche in der Zeitung nach einem Job.,Vielen Glück!
2867,"before you go to that interview, check yourself.",what's to check?,"bevor Sie zu diesem Interview gehen, überprüfen Sie sich selbst.",Was soll ich überprüfen?
2868,what's to check?,are your nails clean?,Was soll ich überprüfen?,sind Ihre Nägel sauber?
2869,are your nails clean?,"yes, they are.",sind Ihre Nägel sauber?,"ja, das ist es."
2870,"yes, they are.",did you double-check your nose and teeth?,"ja, das ist es.",Haben Sie Ihre Nase und Zähne doppelt geprüft?
2871,did you double-check your nose and teeth?,"they are clean, too.",Haben Sie Ihre Nase und Zähne doppelt geprüft?,Sie sind auch sauber.
2872,"they are clean, too.",did you shine your shoes?,Sie sind auch sauber.,hatt ihr deine Schuhe glänzen lassen?
2873,did you shine your shoes?,my shoes are shined.,hatt ihr deine Schuhe glänzen lassen?,ich glänzte meine Schuhe.
2874,my shoes are shined.,do your socks match?,ich glänzte meine Schuhe.,fügen Ihre Socken?
2875,do your socks match?,of course they match.,fügen Ihre Socken?,Natürlich stimmen sie mit.
2876,of course they match.,"no, they don't. one is black and one is dark blue.",Natürlich stimmen sie mit.,- es ist schwarz und dunkelblau.
2877,"no, they don't. one is black and one is dark blue.",yikes! thank you.,- es ist schwarz und dunkelblau.,Vielen Dank.
2878,life is hard.,it sure is.,Das Leben ist schwierig.,es ist sicher.
2879,it sure is.,i thought school was hard.,es ist sicher.,"ich dachte, die Schule sei hart."
2880,i thought school was hard.,"me, too. i couldn't wait to graduate.","ich dachte, die Schule sei hart.","Ich habe mich auch daran gewöhnt, ich konnte nicht warten, bis ich"
2881,"me, too. i couldn't wait to graduate.","but now work is hard, too.","Ich habe mich auch daran gewöhnt, ich konnte nicht warten, bis ich",aber jetzt ist auch die Arbeit hart.
2882,"but now work is hard, too.",i agree. work is just as hard as school.,aber jetzt ist auch die Arbeit hart.,"Ich stimme zu, dass die Arbeit genauso hart ist wie die Schule."
2883,i agree. work is just as hard as school.,sometimes i wish i was back in school.,"Ich stimme zu, dass die Arbeit genauso hart ist wie die Schule.","manchmal wünschte ich, ich wäre wieder in die Schule"
2884,sometimes i wish i was back in school.,"me, too. school was fun.","manchmal wünschte ich, ich wäre wieder in die Schule","Sehr freundliches Personal, freundliches Personal, freundliches Personal"
2885,"me, too. school was fun.",and it was only 12 years.,"Sehr freundliches Personal, freundliches Personal, freundliches Personal",und es war nur 12 Jahre.
2886,and it was only 12 years.,it went by pretty fast.,und es war nur 12 Jahre.,es hat ziemlich schnell gegangen.
2887,it went by pretty fast.,but work goes on forever!,es hat ziemlich schnell gegangen.,aber die Arbeit geht fort!
2888,but work goes on forever!,we have to work for 30 years!,aber die Arbeit geht fort!,Wir müssen 30 Jahre arbeiten!
2889,i'm sleepy.,so am i.,ich bin schlafend.,"ich habe es nicht geschafft, ich habe es nicht geschafft"
2890,so am i.,i had a long day.,"ich habe es nicht geschafft, ich habe es nicht geschafft","Sehr freundliches Personal, freundliches Personal, freundliches Personal"
2891,i had a long day.,so did i.,"Sehr freundliches Personal, freundliches Personal, freundliches Personal",Das war auch der Fall.
2892,so did i.,i didn't even have lunch.,Das war auch der Fall.,The hotel is very clean and the staff were very helpful.
2893,i didn't even have lunch.,neither did i.,The hotel is very clean and the staff were very helpful.,i.
2894,neither did i.,i was busy the whole day.,i.,"Sehr freundliches Personal, freundliches Personal, hilfsbereite"
2895,i was busy the whole day.,so was i.,"Sehr freundliches Personal, freundliches Personal, hilfsbereite","ich habe es nicht geschafft, ich habe es nicht geschafft"
2896,so was i.,i had to bring work home with me.,"ich habe es nicht geschafft, ich habe es nicht geschafft",ich musste mit mir Arbeit nach Hause bringen.
2897,i had to bring work home with me.,i did too.,ich musste mit mir Arbeit nach Hause bringen.,"Sehr freundliches Personal, freundliches Personal, hilfsbereite"
2898,i did too.,your day was just like mine.,"Sehr freundliches Personal, freundliches Personal, hilfsbereite",Ihr Tag war wie mein.
2899,your day was just like mine.,of course it was. we work together!,Ihr Tag war wie mein.,"Natürlich war es, wir arbeiten zusammen!"
2900,i don't like my job.,what do you do?,ich mag meine Arbeit nicht.,Was tun Sie?
2901,what do you do?,i'm a babysitter.,Was tun Sie?,i'm a babysitter.
2902,i'm a babysitter.,is that a lot of work?,i'm a babysitter.,Ist das eine Menge Arbeit?
2903,is that a lot of work?,babies cry all the time.,Ist das eine Menge Arbeit?,Babys schreien immer.
2904,babies cry all the time.,you have to change their diapers.,Babys schreien immer.,Sie müssen ihre Windeln ändern.
2905,you have to change their diapers.,i have to feed them.,Sie müssen ihre Windeln ändern.,ich muss sie füttern.
2906,i have to feed them.,are you looking for another job?,ich muss sie füttern.,Suchen Sie einen anderen Job?
2907,are you looking for another job?,"no, i'm looking for another family.",Suchen Sie einen anderen Job?,"ich hoffe, ich habe eine andere Familie."
2908,"no, i'm looking for another family.",another family?,"ich hoffe, ich habe eine andere Familie.",eine andere Familie?
2909,another family?,a family with only one baby.,eine andere Familie?,eine Familie mit nur einem Kind.
2910,a family with only one baby.,that's a good idea.,eine Familie mit nur einem Kind.,Das ist eine gute Idee.
2911,i need a job.,what was your last job?,Ich brauche einen Job.,Was war Ihre letzte Aufgabe?
2912,what was your last job?,i was a painter.,Was war Ihre letzte Aufgabe?,ich war Maler.
2913,i was a painter.,what happened?,ich war Maler.,Was ist passiert?
2914,what happened?,i got laid off because there was no work.,Was ist passiert?,"ich habe mich entlassen, weil es keine Arbeit gab."
2915,i got laid off because there was no work.,what else can you do?,"ich habe mich entlassen, weil es keine Arbeit gab.",Was können Sie sonst tun?
2916,what else can you do?,i'm a handyman.,Was können Sie sonst tun?,i'm a handyman.
2917,i'm a handyman.,can you fix a dripping faucet in a kitchen sink?,i'm a handyman.,Können Sie einen trinkenden Fackel in einem Küchensofa beheben?
2918,can you fix a dripping faucet in a kitchen sink?,of course.,Können Sie einen trinkenden Fackel in einem Küchensofa beheben?,Natürlich.
2919,of course.,then i have a job for you in my kitchen.,Natürlich.,dann habe ich einen Job für Sie in meiner Küche.
2920,then i have a job for you in my kitchen.,it will cost you only $20 plus parts.,dann habe ich einen Job für Sie in meiner Küche.,es kostet nur 20 $ plus Teile.
2921,it will cost you only $20 plus parts.,okay. that sounds like a fair price.,es kostet nur 20 $ plus Teile.,The room was very clean and the room was very clean.
2922,what would you do if you lost your job?,i have no idea. i've been here for 20 years.,"Was würdest du tun, wenn du deinen Job verloren hast?","Ich habe keine Ahnung, ich bin seit 20 Jahren hier."
2923,i have no idea. i've been here for 20 years.,do you have any other skills?,"Ich habe keine Ahnung, ich bin seit 20 Jahren hier.",Haben Sie andere Fähigkeiten?
2924,do you have any other skills?,"well, i know how to flip hamburgers.",Haben Sie andere Fähigkeiten?,"ich weiß, wie man Hamburger drehen kann."
2925,"well, i know how to flip hamburgers.",no one would hire you to flip hamburgers.,"ich weiß, wie man Hamburger drehen kann.","Kein Mann würde Sie mieten, Hamburger zu drehen."
2926,no one would hire you to flip hamburgers.,have you heard something that you're not telling me?,"Kein Mann würde Sie mieten, Hamburger zu drehen.","hatt ihr etwas gehört, was ihr mir nicht erzählen könnt?"
2927,have you heard something that you're not telling me?,what do you mean?,"hatt ihr etwas gehört, was ihr mir nicht erzählen könnt?",Was meinen Sie?
2928,what do you mean?,are there going to be layoffs at this place?,Was meinen Sie?,Werden an diesem Ort Entlassungen stattfinden?
2929,are there going to be layoffs at this place?,i certainly hope not!,Werden an diesem Ort Entlassungen stattfinden?,ich hoffe sicherlich nicht!
2930,i certainly hope not!,"if you got laid off, you'd be flipping hamburgers, too.",ich hoffe sicherlich nicht!,"Wenn Sie entlassen wurden, würden Sie auch Hamburger werfen."
2931,"if you got laid off, you'd be flipping hamburgers, too.","oh great, we could both work at burger king.","Wenn Sie entlassen wurden, würden Sie auch Hamburger werfen.","oh groß, wir konnten beide am Burgerkönig arbeiten."
2932,"oh great, we could both work at burger king.","maybe we'd get laid off there, too.","oh groß, wir konnten beide am Burgerkönig arbeiten.",Vielleicht würden wir auch dort entlassen.
2933,do your students ever talk about their jobs?,"yes, and they ask me what jobs are the best.",Sprechen Ihre Studenten jemals über ihre Arbeitsplätze?,"ja, und sie fragen mich, welche Arbeitsplätze am besten sind."
2934,"yes, and they ask me what jobs are the best.",i tell my students to become a teacher.,"ja, und sie fragen mich, welche Arbeitsplätze am besten sind.","ich sage meinen Schülern, Lehrer zu werden."
2935,i tell my students to become a teacher.,teaching is a great job.,"ich sage meinen Schülern, Lehrer zu werden.",- Lehren ist eine großartige Aufgabe.
2936,teaching is a great job.,it's the best job i've ever had.,- Lehren ist eine großartige Aufgabe.,"ich habe es schon geschafft, es ist die beste Arbeit,"
2937,it's the best job i've ever had.,what makes it so good?,"ich habe es schon geschafft, es ist die beste Arbeit,",Was macht es so gut?
2938,what makes it so good?,"for me, it's the students.",Was macht es so gut?,"für mich, es ist die Studenten."
2939,"for me, it's the students.",what do you mean?,"für mich, es ist die Studenten.",Was meinen Sie?
2940,what do you mean?,i mean i have wonderful students.,Was meinen Sie?,"ich meine, ich habe wunderbare Studenten."
2941,i mean i have wonderful students.,that must be nice.,"ich meine, ich habe wunderbare Studenten.",Das muss schön sein.
2942,that must be nice.,teaching is the best part of my whole day.,Das muss schön sein.,Lehren ist der beste Teil meines ganzen Tages.
2943,teaching is the best part of my whole day.,you're a lucky man to have a job you love.,Lehren ist der beste Teil meines ganzen Tages.,"Sie sind ein glücklicher Mann, einen Job zu haben, den Sie lieben."
2944,"boy, i'm glad that job is finished.",how long did it take?,"ich bin froh, dass die Arbeit fertig ist.",Wie lange dauerte es?
2945,how long did it take?,"four hours, without a break.",Wie lange dauerte es?,"vier Stunden, ohne Pause."
2946,"four hours, without a break.",it's always nice to finish a job.,"vier Stunden, ohne Pause.","es ist immer schön, einen Job zu beenden."
2947,it's always nice to finish a job.,"well, it's good and bad.","es ist immer schön, einen Job zu beenden.",es ist gut und schlecht.
2948,"well, it's good and bad.",what's bad about it?,es ist gut und schlecht.,Was ist schlecht an dieser Sache?
2949,what's bad about it?,"when you finish, all you do is start another job!",Was ist schlecht an dieser Sache?,"Wenn Sie fertig sind, fangen Sie nur noch einen neuen Job an!"
2950,"when you finish, all you do is start another job!","yes, that's right. it does get boring.","Wenn Sie fertig sind, fangen Sie nur noch einen neuen Job an!","Ja, das ist richtig, es wird langweilig."
2951,"yes, that's right. it does get boring.","especially if it's the same work, over and over.","Ja, das ist richtig, es wird langweilig.","insbesondere wenn es die gleiche Arbeit ist, immer und immer."
2952,"especially if it's the same work, over and over.",but that's what most people do.,"insbesondere wenn es die gleiche Arbeit ist, immer und immer.","aber das ist, was die meisten Menschen tun."
2953,but that's what most people do.,"yes, i guess most of us are stuck in a routine.","aber das ist, was die meisten Menschen tun.","ja, ich nehme an, die meisten von uns sind in einer Routine fest"
2954,"yes, i guess most of us are stuck in a routine.",i wonder if there is any job that you don't repeat over and over.,"ja, ich nehme an, die meisten von uns sind in einer Routine fest","ich frage mich, ob es einen Job gibt, den man nicht"
2955,i think i have the worst boss in the world.,what makes him so bad?,"ich denke, ich habe den schlimmsten Chef der Welt.",Was macht ihn so schlecht?
2956,what makes him so bad?,he's rude and he yells a lot.,Was macht ihn so schlecht?,er ist ungeheuer und er schreitet viel.
2957,he's rude and he yells a lot.,that's hard to take.,er ist ungeheuer und er schreitet viel.,Das ist schwer zu nehmen.
2958,that's hard to take.,i've never heard him say please or thank you.,Das ist schwer zu nehmen.,"ich habe ihn nie gesagt, bitte oder danke Ihnen."
2959,i've never heard him say please or thank you.,he sounds like a real jerk.,"ich habe ihn nie gesagt, bitte oder danke Ihnen.",er klingt wie ein echter Schwanz.
2960,he sounds like a real jerk.,no one at work likes him.,er klingt wie ein echter Schwanz.,Niemand am Arbeitsplatz mag ihn.
2961,no one at work likes him.,can't you report him to his supervisor?,Niemand am Arbeitsplatz mag ihn.,kannt ihr ihn nicht an seinen Aufsichtsrat melden?
2962,can't you report him to his supervisor?,"of course not. if i do that, i'll lose my job.",kannt ihr ihn nicht an seinen Aufsichtsrat melden?,"ich nehme es nicht, wenn ich das tue,"
2963,"of course not. if i do that, i'll lose my job.","yes, they don't like troublemakers or complainers.","ich nehme es nicht, wenn ich das tue,","ja, sie mögen es nicht, Störungsmacher oder Beschwer"
2964,"yes, they don't like troublemakers or complainers.","i can't quit, because i'm making a good salary.","ja, sie mögen es nicht, Störungsmacher oder Beschwer","ich kann nicht aufgeben, weil ich ein gutes Gehalt mache."
2965,"i can't quit, because i'm making a good salary.",you shouldn't choose money over happiness.,"ich kann nicht aufgeben, weil ich ein gutes Gehalt mache.",Sie sollten nicht Geld vor Glück wählen.
2966,what are we going to do?,about what?,Was werden wir tun?,über was?
2967,about what?,about finding a job for me.,über was?,über die Suche nach einem Arbeitsplatz für mich.
2968,about finding a job for me.,you don't need a job. i make enough money for both of us.,über die Suche nach einem Arbeitsplatz für mich.,ich mache genug Geld für beide.
2969,you don't need a job. i make enough money for both of us.,that doesn't matter. i don't want to sit around.,ich mache genug Geld für beide.,"ich sage es nicht, ich möchte mich nicht stör"
2970,that doesn't matter. i don't want to sit around.,"okay, what kind of job do you want?","ich sage es nicht, ich möchte mich nicht stör","okay, welche Art von Job wollen Sie?"
2971,"okay, what kind of job do you want?",i'm not sure.,"okay, welche Art von Job wollen Sie?",ich bin nicht sicher.
2972,i'm not sure.,"well, you should do something that you enjoy.",ich bin nicht sicher.,"es ist gut, dass Sie etwas tun sollten, was Sie genießen."
2973,"well, you should do something that you enjoy.",i enjoy selling. i was born to sell.,"es ist gut, dass Sie etwas tun sollten, was Sie genießen.","ich habe es geschafft, ich habe es geschafft,"
2974,i enjoy selling. i was born to sell.,"okay, what do you want to sell?","ich habe es geschafft, ich habe es geschafft,","okay, was wollen Sie verkaufen?"
2975,"okay, what do you want to sell?",cigarette lighters. i'll make a fortune.,"okay, was wollen Sie verkaufen?",i'm not sure what to do with the slacks.
2976,cigarette lighters. i'll make a fortune.,but you hate cigarettes and you hate smoking!,i'm not sure what to do with the slacks.,aber du hasst Zigaretten und du hasst Rauchen!
2977,a new hotel is looking for workers.,"yes, i saw it on the tv news.",Ein neues Hotel sucht Arbeiter.,ich habe es in den Fernsehnachrichten gesehen.
2978,"yes, i saw it on the tv news.",they need 300 new workers.,ich habe es in den Fernsehnachrichten gesehen.,sie brauchen 300 neue Arbeitnehmer.
2979,they need 300 new workers.,"and 4,000 people showed up.",sie brauchen 300 neue Arbeitnehmer.,und 4000 Menschen kamen auf.
2980,"and 4,000 people showed up.",so many people are out of work.,und 4000 Menschen kamen auf.,so viele Menschen sind nicht beruflich.
2981,so many people are out of work.,"i still have my job, thank goodness.",so viele Menschen sind nicht beruflich.,"Ich habe noch meine Arbeit, Gott sei Dank."
2982,"i still have my job, thank goodness.","so do i, but i'm worried.","Ich habe noch meine Arbeit, Gott sei Dank.","ich habe es nicht geschafft, aber ich bin besorgt."
2983,"so do i, but i'm worried.",me too. there are no guarantees.,"ich habe es nicht geschafft, aber ich bin besorgt.",Auch ich habe keine Garantien.
2984,me too. there are no guarantees.,"if you lose your job, you can move in with me.",Auch ich habe keine Garantien.,"Wenn Sie Ihren Job verlieren, können Sie mit mir einziehen."
2985,"if you lose your job, you can move in with me.","oh, thank you. that's very nice of you.","Wenn Sie Ihren Job verlieren, können Sie mit mir einziehen.","oh, ich danke Ihnen, das ist sehr schön von Ihnen."
2986,"oh, thank you. that's very nice of you.",you would do the same for me.,"oh, ich danke Ihnen, das ist sehr schön von Ihnen.",Sie würden dasselbe für mich tun.
2987,you would do the same for me.,of course. what are friends for?,Sie würden dasselbe für mich tun.,Was sind Freunde für?
